{
  "$schema": "https://json-schema.org/draft/2020-12/schema",
  "title": "NextOps pinned Qwen3.6-35B development candidate, not serving selection",
  "type": "object",
  "additionalProperties": false,
  "required": ["schema_version", "status", "model_id", "source_repository", "source_revision", "quantized_by", "quantizer_runtime_tag", "upstream_repository", "upstream_reference_revision", "conversion_source_revision_verified", "architecture", "quantization", "filename", "size_bytes", "sha256", "chat_template_sha256", "license", "license_source", "native_context_tokens", "qualification_context_tokens", "runtime_commit", "cpu_only_required", "runtime_download_allowed", "preserve_private_thinking", "deployment_selection_allowed", "qualification"],
  "properties": {
    "schema_version": {"const": "1.0.0"},
    "status": {"const": "explicit_provisioning_candidate_not_selected"},
    "model_id": {"const": "nextops-qwen3-6-35b-a3b-q4-k-m"},
    "source_repository": {"const": "https://huggingface.co/bartowski/Qwen_Qwen3.6-35B-A3B-GGUF"},
    "source_revision": {"const": "5c2410d71524f4f72b023ce8daf7a80528226d5f"},
    "quantized_by": {"const": "bartowski"},
    "quantizer_runtime_tag": {"const": "b9222"},
    "upstream_repository": {"const": "https://huggingface.co/Qwen/Qwen3.6-35B-A3B"},
    "upstream_reference_revision": {"const": "995ad96eacd98c81ed38be0c5b274b04031597b0"},
    "conversion_source_revision_verified": {"const": false},
    "architecture": {"const": "qwen35moe"},
    "quantization": {"const": "Q4_K_M"},
    "filename": {"const": "Qwen_Qwen3.6-35B-A3B-Q4_K_M.gguf"},
    "size_bytes": {"const": 22285080192},
    "sha256": {"const": "b46fedd33e0bfb0cae308aa3c158d0a4b2c4a1d2185a1ed6f093cdaf39064772"},
    "chat_template_sha256": {"const": "e84f32a23fdda27689f868aa4a1a5621f41133e51a48d7f3efcbea2839574259"},
    "license": {"const": "Apache-2.0"},
    "license_source": {"const": "https://huggingface.co/Qwen/Qwen3.6-35B-A3B/blob/995ad96eacd98c81ed38be0c5b274b04031597b0/LICENSE"},
    "native_context_tokens": {"const": 262144},
    "qualification_context_tokens": {"const": 16384},
    "runtime_commit": {"const": "b29c606e28a01b1bc8c1351026a0fa6e616bf6c4"},
    "cpu_only_required": {"const": true},
    "runtime_download_allowed": {"const": false},
    "preserve_private_thinking": {"const": false},
    "deployment_selection_allowed": {"const": false},
    "qualification": {
      "type": "object",
      "additionalProperties": false,
      "required": ["desktop_artifact_integrity", "server_artifact_import", "cpu_runtime_load", "bilingual_quality", "thinking_final_answer", "context_latency_recall", "offline_cold_start", "runtime_model_rollback", "guarded_selection"],
      "properties": {
        "desktop_artifact_integrity": {"enum": ["not_run", "partial", "failed", "passed"]},
        "server_artifact_import": {"const": "not_run"},
        "cpu_runtime_load": {"const": "not_run"},
        "bilingual_quality": {"const": "not_run"},
        "thinking_final_answer": {"const": "not_run"},
        "context_latency_recall": {"const": "not_run"},
        "offline_cold_start": {"const": "not_run"},
        "runtime_model_rollback": {"const": "not_run"},
        "guarded_selection": {"const": "not_run"}
      }
    }
  }
}
