{
  "schema_version": "1.0.0",
  "status": "explicit_provisioning_candidate_not_selected",
  "model_id": "nextops-qwen3-6-35b-a3b-q4-k-m",
  "source_repository": "https://huggingface.co/bartowski/Qwen_Qwen3.6-35B-A3B-GGUF",
  "source_revision": "5c2410d71524f4f72b023ce8daf7a80528226d5f",
  "quantized_by": "bartowski",
  "quantizer_runtime_tag": "b9222",
  "upstream_repository": "https://huggingface.co/Qwen/Qwen3.6-35B-A3B",
  "upstream_reference_revision": "995ad96eacd98c81ed38be0c5b274b04031597b0",
  "conversion_source_revision_verified": false,
  "architecture": "qwen35moe",
  "quantization": "Q4_K_M",
  "filename": "Qwen_Qwen3.6-35B-A3B-Q4_K_M.gguf",
  "size_bytes": 22285080192,
  "sha256": "b46fedd33e0bfb0cae308aa3c158d0a4b2c4a1d2185a1ed6f093cdaf39064772",
  "chat_template_sha256": "e84f32a23fdda27689f868aa4a1a5621f41133e51a48d7f3efcbea2839574259",
  "license": "Apache-2.0",
  "license_source": "https://huggingface.co/Qwen/Qwen3.6-35B-A3B/blob/995ad96eacd98c81ed38be0c5b274b04031597b0/LICENSE",
  "native_context_tokens": 262144,
  "qualification_context_tokens": 16384,
  "runtime_commit": "b29c606e28a01b1bc8c1351026a0fa6e616bf6c4",
  "cpu_only_required": true,
  "runtime_download_allowed": false,
  "preserve_private_thinking": false,
  "deployment_selection_allowed": false,
  "qualification": {
    "desktop_artifact_integrity": "partial",
    "server_artifact_import": "not_run",
    "cpu_runtime_load": "not_run",
    "bilingual_quality": "not_run",
    "thinking_final_answer": "not_run",
    "context_latency_recall": "not_run",
    "offline_cold_start": "not_run",
    "runtime_model_rollback": "not_run",
    "guarded_selection": "not_run"
  }
}
